{
  "manifest_id": "operator-manifest-spv-sym-symbolic",
  "manifest_version": "1.0.0",
  "task_id": "spv_sym_symbolic_v1",
  "mode": "activative",
  "category_id": "supervisuals",
  "task": {
    "goal": "Compile the SPV-SYM-Symbolic SuperVisual harness -- a single-frame portrait card that carries its argument through one symbolic device (before/after gesture split, double-exposure wealth overlay, numbered listicle, or persona-identification grid) -- into a governed Builder contract, preserving the format's real visual-syntax lineage.",
    "success_condition": "The exported PortableAtomicHarnessDefinition binds to category_id 'supervisuals', preserves all activative_input lineage refs unmutated, and carries this harness's wrong_reading_locks into category_binding.wrong_reading_locks so they survive into campaign execution.",
    "atomic_boundary": "One ratified SPV-SYM-Symbolic reference set (eleven portrait/listicle/grid specimens plus the Drill-me doctrine pair) becomes one structural Builder contract. No media is generated, no campaign is executed, and no per-client semantic content is attached at this step.",
    "input_contract": {
      "type": "object",
      "required": [
        "source_expression_moment",
        "voice_context"
      ],
      "properties": {
        "source_expression_moment": {
          "type": "string",
          "minLength": 1,
          "description": "The single quote line, listicle headline, or persona-identification prompt this SuperVisual will render for one runtime pass -- e.g. a struggle-to-triumph line, a numbered 'mistakes' or 'don't say / say' list, or a 'which one are you' grid caption."
        },
        "voice_context": {
          "type": "object",
          "description": "Runtime brand-voice parameters for this render: palette family (gold/black authority, red/orange warning, blue wealth duotone), gesture register (struggle, triumph, warning stare, aspirational drive), and single-quote vs numbered-listicle vs persona-grid layout choice.",
          "properties": {
            "palette_family": {
              "type": "string"
            },
            "gesture_register": {
              "type": "string"
            },
            "layout_variant": {
              "type": "string",
              "enum": [
                "single_quote",
                "split_before_after",
                "numbered_listicle",
                "persona_grid",
                "double_exposure_symbol"
              ]
            }
          }
        }
      }
    },
    "output_contract": {
      "type": "object",
      "required": [
        "rendered_supervisual_spec"
      ],
      "properties": {
        "rendered_supervisual_spec": {
          "type": "object",
          "description": "The composed single-frame spec (component bboxes, role/why bindings, watermark placement, forbidden-pattern checks) ready to hand to the render runtime. Structural only -- no rasterized media."
        }
      }
    },
    "required_context": [
      "frozen_activative_intelligence",
      "authority_evidence"
    ],
    "capability_requirements": [
      "activative_contract_validation"
    ],
    "acceptance_tests": [
      "wrong_reading_locks_are_preserved",
      "identity_dna_is_not_mutated",
      "category_binding_resolves_to_supervisuals"
    ],
    "authority_ref": "one-harness-build-prompt@1.0.0#sha256:90be016c6f0f466ba7187e58c38d61829d59009291874a8c2abdb8af91cca566",
    "provenance_refs": [
      "harness-gap-analysis-and-build-skill@2026-08-01#sha256:661cd38483fcbfd39f70a9fbff14582a65a14ad188737268d1759b12fe2d4d49",
      "visual_syntax_composition_compiler@1.0.0#sha256:788d157313e2aed64b259b22bdbd51c0763c06953faa92a81cdf795cd604e724"
    ]
  },
  "activative_input": {
    "source_premise_ref": "drill-me-format-doctrine@1.0.0#sha256:86ac29658cd37988ba78552c2917bb6932a8d3848c8aabe3a58ccc4c4e7039f5",
    "identity_dna_ref": "specimen-portrait-identity-anchor@1.0.0#sha256:a1dc636ade4c66072f158cd503915b780f7ecfa915ea4b69219b142bc81e9859",
    "context_premise_ref": "harness-library-context-premise@2026-08-01#sha256:661cd38483fcbfd39f70a9fbff14582a65a14ad188737268d1759b12fe2d4d49",
    "resonance_map_ref": "specimen-resonance-struggle-triumph@1.0.0#sha256:cef6f9e510f192ecda0950f740931e7b6491c4f141ff4c856ba416d3d8861550",
    "matrix_of_edging_ref": "drill-me-bbox-why-matrix@1.0.0#sha256:6790dc37c4e789f7dfa0cab5ed02c0b9f880e693d312054cfcea7d6dd5e615ae",
    "activative_intelligence_pack_ref": "spv-sym-symbolic-specimen-pack@1.0.0#sha256:0a9ec137aa2851e46936bb3fc22434809d802e2d399695d056686ee76b80c4df",
    "hidden_pressure": "The viewer scrolls past personal-brand authority content constantly; this format has one static frame to make the viewer feel personally addressed -- through a gesture, a listicle item, or a persona grid -- before they swipe past.",
    "activation_directions": [
      "recognize",
      "self-locate",
      "affirm"
    ],
    "roles": [
      "mentor-figure",
      "viewer"
    ],
    "stance": "Direct, declarative, and symbolically compressed -- one gesture, one overlay, or one list stands in for the whole argument.",
    "stakes": [
      "credibility of the personal brand",
      "the viewer's sense of being personally seen",
      "accurate representation of the mentor's stated experience"
    ],
    "identity_urges": [
      "want the shortcut without losing self-respect",
      "want to be told the truth plainly"
    ],
    "participation_design": "A single static frame carries either a symbolic before/after gesture, a numbered list, or a persona-identification grid, inviting the viewer to privately locate themselves in it -- and, for the grid sub-pattern, to tag a friend in the comments.",
    "intended_reaction": "The viewer recognizes themselves in the gesture, list item, or persona and feels the mentor is speaking directly to their specific situation.",
    "smallest_useful_commitment": "Pause the scroll and read the full list or caption before swiping past.",
    "evidence_provenance_refs": [
      "specimen-split-crowd-portrait@1.0.0#sha256:d0f78ec66ffc5ed5ab7cde839a95b566e79757a721cf5910f4b714d545f24020",
      "specimen-pointing-listicle-portrait@1.0.0#sha256:cfdf08654edee252f1ab40cd81e8e05246125c2a5afc0468f7dcfb4dfc2c4f44",
      "specimen-judgment-listicle-portrait@1.0.0#sha256:738161be42e9a5762aa158294d6f4aa12d7cce4358755892f18b4c8891cac1cf",
      "specimen-persona-identification-grid@1.0.0#sha256:cd248c9292f3e8cc6030e2b51bae01884ffb256b2b33dd9b56035da612f81439"
    ],
    "evaluation_contract_ref": "drill-me-evaluation-doctrine@1.0.0#sha256:1b0200131ce99b29f90adfdcc18ef43f418ba4952c8e74edb90d1df7fbec5ef0",
    "wrong_reading_locks": [
      "Do not let the before/after split-portrait (visible struggle gesture next to visible triumph gesture) be read as a literal, dated timeline of the mentor's own biography -- it is a symbolic emotional-state device, not a factual claim about a specific past event.",
      "Do not let numbered 'mistakes' or 'reasons' listicles be read as exhaustive, clinically-validated business, financial, or psychological advice -- they are motivational framing, not licensed counsel, and must not imply guaranteed outcomes.",
      "Do not let money/wealth double-exposure overlays (currency, luxury vehicles) be read as a specific income claim, earnings promise, or guarantee of financial results -- they are aspirational symbolism only.",
      "Do not let the judgmental 'stay away from people who...' listicle be read as targeted advice to sever specific named relationships, or as license to harass any real, identifiable person -- it is a self-accountability prompt aimed at the viewer's own habits.",
      "Do not let the persona-identification grid ('which one are you') be read as a validated personality or psychological assessment -- it is a playful, non-clinical self-identification engagement device."
    ],
    "aligned_primitive_ids": [
      "PRM-BUS-001",
      "PRM-PSY-018"
    ],
    "wrong_reading_locks_meaning": [
      "Do not use generic clip-art symbols -- PRM-BUS-001 requires high-resonance symbolic anchors.",
      "Do not leave symbol meaning ambiguous without textual context -- PRM-PSY-018 anchors metaphor to message."
    ]
  }
}