{
  "manifest_id": "operator-manifest-sv-relatable-tweetcard",
  "manifest_version": "1.0.0",
  "task_id": "sv_relatable_tweetcard_v1",
  "mode": "activative",
  "category_id": "supervisuals",
  "task": {
    "goal": "Compile the MEM-REL-Relatable single-frame quote-card format (persona tweet header + reaction photo + caption/statistic overlay) into a governed SuperVisuals structural contract.",
    "success_condition": "The compiled structural contract preserves the persona header block, the single reaction image with its overlay text or speech-bubble quote, and every wrong_reading_lock intact and unweakened.",
    "atomic_boundary": "One ratified relatable-moment concept becomes exactly one single-frame structural contract; no multi-slide sequencing, video timeline, or animation frame series is produced.",
    "input_contract": {
      "type": "object",
      "required": [
        "source_expression_moment",
        "voice_context"
      ],
      "properties": {
        "source_expression_moment": {
          "type": "string",
          "minLength": 1,
          "description": "The specific relatable football-fan pain point, jab, or in-joke this instance dramatizes, e.g. an injury setback, a transfer/sponsor jab, or an academy-release fear."
        },
        "voice_context": {
          "type": "string",
          "minLength": 1,
          "description": "The persona's caption register for this instance: phrasing, emoji use, and fan vernacular consistent with the branded account voice observed in the specimens."
        }
      }
    },
    "output_contract": {
      "type": "object",
      "required": [
        "structural_contract"
      ],
      "properties": {
        "structural_contract": {
          "type": "object"
        }
      }
    },
    "required_context": [
      "frozen_activative_intelligence",
      "authority_evidence",
      "persona_visual_identity_reference"
    ],
    "capability_requirements": [
      "activative_contract_validation"
    ],
    "acceptance_tests": [
      "single_frame_boundary_is_not_exceeded",
      "persona_header_block_is_preserved",
      "wrong_reading_locks_survive_compilation"
    ],
    "authority_ref": "harness-gap-analysis-and-build-skill@1.0.0#sha256:661cd38483fcbfd39f70a9fbff14582a65a14ad188737268d1759b12fe2d4d49",
    "provenance_refs": [
      "one-harness-build-prompt@1.0.0#sha256:90be016c6f0f466ba7187e58c38d61829d59009291874a8c2abdb8af91cca566",
      "drill-me-format@1.0.0#sha256:86ac29658cd37988ba78552c2917bb6932a8d3848c8aabe3a58ccc4c4e7039f5",
      "drill-me-bbox-why@1.0.0#sha256:6790dc37c4e789f7dfa0cab5ed02c0b9f880e693d312054cfcea7d6dd5e615ae",
      "visual_syntax_composition_compiler@1.0.0#sha256:788d157313e2aed64b259b22bdbd51c0763c06953faa92a81cdf795cd604e724"
    ]
  },
  "activative_input": {
    "source_premise_ref": "mem-rel-relatable-specimen-visual-1@1.0.0#sha256:61dbf5fc3ce8d50bd4fefc033d92002a52789a766b9a0b307449fbdba2e34dc9",
    "identity_dna_ref": "mem-rel-relatable-persona-identity-specimen@1.0.0#sha256:e691d9a7217f7a93b8719dfc88d1c8b5d683a2918191bdff42decdc1ec1649c0",
    "context_premise_ref": "drill-me-format-context@1.0.0#sha256:86ac29658cd37988ba78552c2917bb6932a8d3848c8aabe3a58ccc4c4e7039f5",
    "resonance_map_ref": "mem-rel-relatable-specimen-visual-3@1.0.0#sha256:ef3fab82d5382ce3df39ac1d9900e8746dcf9de5f315bcc44e0a804f58777b08",
    "matrix_of_edging_ref": "drill-me-bbox-why-matrix@1.0.0#sha256:6790dc37c4e789f7dfa0cab5ed02c0b9f880e693d312054cfcea7d6dd5e615ae",
    "activative_intelligence_pack_ref": "harness-gap-analysis-and-build-skill-pack@1.0.0#sha256:661cd38483fcbfd39f70a9fbff14582a65a14ad188737268d1759b12fe2d4d49",
    "hidden_pressure": "The audience wants to feel privately recognized inside a shared football-fan wound (injury heartbreak, sponsor cynicism, academy rejection) without admitting vulnerability outright; tagging a friend or laughing at the caption lets them point at the feeling instead of naming it.",
    "activation_directions": [
      "recognize",
      "laugh",
      "tag"
    ],
    "roles": [
      "narrator_persona",
      "viewer",
      "tagged_friend"
    ],
    "stance": "Wry, communal, and self-deprecating on behalf of the whole fan base \u2014 never mocking the individual tagged friend, only the shared situation.",
    "stakes": [
      "stay funny, not cruel",
      "keep the joke legible as fan commentary, not real news",
      "avoid implying a real, identifiable person actually said the caption"
    ],
    "identity_urges": [
      "belong to the fan community",
      "signal insider football knowledge",
      "share a private joke publicly"
    ],
    "participation_design": "One-tap resonance: the viewer either tags a friend the caption fits, reacts, or shares; no further commitment is asked of them.",
    "intended_reaction": "The viewer laughs in recognition, tags a friend the caption fits, and associates the persona account with 'gets our world.'",
    "smallest_useful_commitment": "Tag one friend, or leave one reaction.",
    "evidence_provenance_refs": [
      "mem-rel-relatable-evidence-visual-1@1.0.0#sha256:61dbf5fc3ce8d50bd4fefc033d92002a52789a766b9a0b307449fbdba2e34dc9",
      "mem-rel-relatable-evidence-visual-2@1.0.0#sha256:e691d9a7217f7a93b8719dfc88d1c8b5d683a2918191bdff42decdc1ec1649c0",
      "mem-rel-relatable-evidence-visual-3@1.0.0#sha256:ef3fab82d5382ce3df39ac1d9900e8746dcf9de5f315bcc44e0a804f58777b08"
    ],
    "evaluation_contract_ref": "one-harness-build-prompt-evaluation@1.0.0#sha256:90be016c6f0f466ba7187e58c38d61829d59009291874a8c2abdb8af91cca566",
    "wrong_reading_locks": [
      "Do not let the composited tweet-card (persona avatar, handle, verified badge) be mistaken for an authentic captured screenshot of a real posted tweet \u2014 it must stay legible as a designed quote-card template, not evidence of a real utterance.",
      "Do not let any real, named public figure's photo used in a reaction-template layout be read as if that person authored, endorsed, or spoke the overlaid caption; it must read as fan commentary about them, never as their own statement.",
      "Do not let the photorealistic anonymous subject in a first-person quote bubble be mistaken for a real, identifiable individual making a real factual claim \u2014 the figure is an illustrative composite, not a sourced testimonial.",
      "Do not let a bold on-image statistic be read as sourced or verified reporting; it is a dramatized emotional hook and must not be paired with a real club or player's name without explicit satire framing.",
      "Do not let a real brand name used in a sponsor-swap joke be read as an announced or confirmed sponsorship deal; it must remain legible as speculation, not news."
    ],
    "aligned_primitive_ids": [
      "PRM-HUM-009",
      "PRM-PSY-018"
    ],
    "wrong_reading_locks_meaning": [
      "Do not frame relatable meme moments as trivial distraction -- PRM-HUM-009 uses humor for pattern recognition.",
      "Do not over-explain the comedic premise in body copy -- PRM-PSY-018 relies on immediate audience recognition."
    ]
  }
}